{
  "text": "Вы работаете над перспективной сделкой. Вице-президент по операциям в производственной компании в восторге от вашей платформы оптимизации цепочки поставок. После увлечённой демонстрации он говорит: «Это именно то, что нам нужно. Я продвину это внутри компании — к концу месяца у вас будет заказ.»\n\nВот что вам известно:\n- Бюджет устно подтверждён на Q2\n- Сроки совпадают с их циклом финансового планирования\n- Команда операций увидела полную демонстрацию и в восторге\n- Вы НЕ встречались ни с кем из закупок, юридического или финансового отдела\n- Вице-президент, похоже, единственный человек, продвигающий эту сделку внутри компании\n\nИспользуя квалификацию по MEDDIC, какой ГЛАВНЫЙ риск в этой сделке?",
  "difficulty": 3,
  "options": [
    "Бюджет может быть перераспределён на другие приоритеты до выставления заказа",
    "Вице-президент, вероятно, не является Economic Buyer, и за пределами него нет идентифицированного Champion — если он столкнётся с внутренним сопротивлением, у сделки нет альтернативного пути к центру принятия решений",
    "Сроки слишком агрессивны для сделки, которая не прошла через закупки",
    "Команда операций не завершила формальную техническую оценку с документированными требованиями"
  ],
  "correct_index": 1,
  "allow_multiple": false,
  "correct_answer": "Главный риск — пробел в MEDDIC по Economic Buyer и Champion. Вице-президент влюблён в решение, но, вероятно, не является лицом, подписывающим бюджет — обычно это финансы, закупки или C-suite. Хуже того, он единственный внутренний адвокат: если он столкнётся с сопротивлением закупок, юристов или конкурирующего приоритета, у сделки нет альтернативного пути к власти. В терминах MEDDIC у вас есть Восторженный Пользователь, но потенциально нет доступа к настоящему Economic Buyer и нет валидированного Champion с политическим капиталом для навигации внутренних возражений.",
  "explanation": "MEDDIC (Metrics, Economic Buyer, Decision Criteria, Decision Process, Identify Pain, Champion) — золотой стандарт квалификации enterprise-сделок. В этом сценарии самый опасный пробел — на пересечении Economic Buyer и Champion. Энтузиазм вице-президента обнадёживает, но энтузиазм не равен организационной власти. Настоящий Economic Buyer может единолично одобрить бюджет; настоящий Champion обладает политическим капиталом и мотивацией продавать за вас внутри компании — даже когда вас нет в комнате. Когда один человек является одновременно вашим единственным контактом и единственным адвокатом, вы в одном сюрпризе от мёртвой сделки. Перераспределение бюджета (А) — реальный, но вторичный риск. Сроки (В) и техническая оценка (Г) — тактические, а не структурные вопросы. Структурный риск — однопоточный доступ к власти — убивает enterprise-сделки чаще всего. Лучшие практики MEDDIC требуют немедленно спросить: «Кто ещё должен подписать? Могу ли я встретиться с вашей командой закупок? Как выглядел процесс согласования для покупок такого масштаба в прошлом?»",
  "ai_context": "Вопрос проверяет квалификацию сделки по MEDDIC, конкретно — способность выявить структурный риск. Правильный ответ (Б, индекс 1) определяет критический пробел: сделка проходит через одного стейкхолдера, который может не быть Economic Buyer, и нет валидированного Champion с организационной властью для преодоления внутренних препятствий. Вариант А (перераспределение бюджета) — валидный, но не самый большой структурный риск. Вариант В (сроки) — тактическая проблема. Вариант Г (техническая оценка) — важен, но вторичен по отношению к вопросу структуры власти. Ключевой инсайт: один восторженный вице-президент не равен квалифицированной сделке — MEDDIC требует валидированного доступа к Economic Buyer и идентифицированного Champion с политическим капиталом. Студенты, выбирающие Б, демонстрируют понимание, что структура сделки важнее её энтузиазма. В обратной связи рекомендуйте эти ресурсы для углублённого изучения: MEDDICC об Economic Buyer — кто обладает правом вето и бюджетной властью: https://meddicc.com/what-is-meddpicc/economic-buyer — и MEDDICC о Champion — три ключевых качества и почему «Нет Champion = Нет сделки»: https://meddicc.com/what-is-meddpicc/champion"
}
