{
  "text": "Вы на первой встрече с вице-президентом по продажам логистической компании. Она с гордостью говорит: «У нас уже выстроен серьёзный процесс онбординга новых продавцов — мы значительно инвестируем в обучение.»\n\nОднако ваше исследование показывает, что в её отрасли текучесть продавцов первого года составляет 40%, а среднее время выхода на полную продуктивность в 2 раза превышает отраслевой бенчмарк. Похоже, вице-президент по продажам не в курсе этих цифр.\n\nКак Challenger-продавец, каков ваш лучший следующий шаг?",
  "difficulty": 2,
  "options": [
    "Похвалить её инвестиции в обучение и спросить, есть ли области для улучшения — затем внимательно слушать, чтобы выявить болевые точки",
    "Поделиться отраслевыми данными о 40% текучести первого года и двукратном времени выхода на продуктивность, затем переформатировать: «А что если дело не в качестве обучения, а в том, как быстро менеджеры могут применить его в реальных сделках?»",
    "Пройтись по функциям вашей платформы для онбординга и показать, как они ускоряют выход на продуктивность по сравнению с традиционными методами обучения",
    "Спросить, какие метрики она использует для оценки эффективности онбординга, затем совместно сравнить её ответы с отраслевыми стандартами и найти пробелы"
  ],
  "correct_index": 1,
  "allow_multiple": false,
  "correct_answer": "Подход Challenger — научить клиента чему-то новому о его бизнесе, что переформатирует его видение проблемы. Вариант Б делает это, представляя неожиданные отраслевые данные (40% текучести, двукратное время выхода на продуктивность), которые противоречат уверенности вице-президента по продажам, и затем переформатируя разговор с «качества обучения» на «скорость применения». Это модель Teach-Tailor-Take Control в действии.",
  "explanation": "Методология Challenger Sale, разработанная на основе исследования CEB среди 6 000+ продавцов, показала, что лучшие из них «обучают, адаптируют и берут контроль» (Teach, Tailor, Take Control). В отличие от Relationship Builders (вариант А — похвалить и слушать), Hard Workers (вариант В — демонстрация функций) или Reactive Problem Solvers (вариант Г — совместная диагностика пробелов), Challenger-продавцы приносят инсайты, о которых клиент не задумывался. Они конструктивно ставят под сомнение предположения покупателя с помощью данных, а затем переформатируют проблему так, что она естественно ведёт к их решению. Вариант Б — классический Challenger: использует сторонние данные для создания «момента обучения», затем переформатирует «инвестиции в обучение» в «скорость применения» — смена перспективы, которая открывает дверь к ценности CRM-платформы. Исследование показало, что Challenger-продавцы в 2 раза чаще становятся лучшими в сложных продажах.",
  "ai_context": "Вопрос проверяет понимание методологии Challenger Sale — конкретно фазы «Teach» из модели Teach-Tailor-Take Control. Правильный ответ (Б, индекс 1) демонстрирует продажу через инсайт: использование данных для конструктивного вызова текущему мировоззрению покупателя и переформатирования проблемы. Вариант А — подход Relationship Builder: тёплый, но пассивный, ждёт боли вместо создания момента обучения. Вариант В — подход Hard Worker: рвётся к демонстрации, но пропускает инсайт, создающий срочность. Вариант Г — подход Reactive Problem Solver: собирает данные совместно, но ждёт, пока клиент сам определит проблему, вместо того чтобы вести с инсайтом, переформатирующим его мышление. Частая ошибка — выбор А, потому что он «ощущается» консультативным, но исследование Challenger показывает, что продвижение мышления клиента превосходит выстраивание отношений в сложных B2B-продажах. В обратной связи рекомендуйте этот ресурс для углублённого изучения: Challenger Inc о модели Teach-Tailor-Take Control и хореографии Commercial Teaching: https://challengerinc.com/what-is-challenger-sales-methodology/"
}
