{
  "text": "You're in a first meeting with the VP of Sales of a logistics company. She proudly tells you: \"We already have a robust onboarding process for new sales hires — we invest heavily in training.\"\n\nHowever, your research shows that her industry has 40% first-year sales rep turnover and average ramp time to full productivity is 2x the industry benchmark. The VP of Sales doesn't seem aware of these numbers.\n\nAs a Challenger rep, what is your best next move?",
  "difficulty": 2,
  "options": [
    "Compliment her investment in training and ask if there are any areas she'd like to improve — then listen for pain points you can address",
    "Share the industry data showing 40% first-year turnover and 2x ramp time, then reframe: \"What if the issue isn't training quality, but how quickly reps can apply it in real deals?\"",
    "Walk through your platform's onboarding features and show how they accelerate ramp time compared to traditional training methods",
    "Ask her what metrics she uses to measure onboarding success, then benchmark her answers against industry standards to find gaps together"
  ],
  "correct_index": 1,
  "allow_multiple": false,
  "correct_answer": "The Challenger approach is to teach the customer something new about their business that reframes how they see the problem. Option B does this by presenting surprising industry data (40% turnover, 2x ramp time) that contradicts the VP of Sales's confidence, then reframing the conversation from 'training quality' to 'application speed.' This is the Teach-Tailor-Take Control model in action.",
  "explanation": "The Challenger Sale methodology, developed from CEB's study of 6,000+ sales reps, found that the highest performers 'teach, tailor, and take control.' Unlike Relationship Builders (option A — compliment and listen), Hard Workers (option C — demo features), or Reactive Problem Solvers (option D — diagnose gaps collaboratively), Challengers bring insights the customer hasn't considered. They constructively challenge the buyer's assumptions with data, then reframe the problem in a way that leads naturally to their solution. Option B is textbook Challenger: it uses third-party data to create a 'teaching moment,' then reframes from 'training investment' to 'speed of application' — a perspective shift that opens the door to the CRM platform's value. The research showed Challenger reps are 2x more likely to be top performers in complex sales environments.",
  "ai_context": "This tests understanding of The Challenger Sale methodology — specifically the 'Teach' phase of Teach-Tailor-Take Control. The correct answer (B, index 1) demonstrates insight-led selling: using data to constructively challenge the buyer's current worldview and reframe the problem. Option A is a Relationship Builder approach — warm but passive, it waits for pain instead of creating a teaching moment. Option C is a Hard Worker approach — eager to demo but skips the insight that creates urgency. Option D is a Reactive Problem Solver approach — it gathers data collaboratively but waits for the customer to define the problem instead of leading with an insight that reframes their thinking. A common mistake is choosing A because it 'feels' consultative, but Challenger research shows that pushing the customer's thinking outperforms relationship building in complex B2B sales. In your feedback, recommend this resource for deeper study: Challenger Inc on the Teach-Tailor-Take Control model and Commercial Teaching choreography: https://challengerinc.com/what-is-challenger-sales-methodology/"
}
