{
  "text": "Какое утверждение лучше всего описывает обучение с учителем?",
  "difficulty": 1,
  "options": [
    "Обучение без меток через поиск структуры в данных",
    "Обучение на размеченных парах «вход–выход», чтобы выучить отображение",
    "Обучение через пробу и ошибку с наградами и штрафами",
    "Жёсткое программирование правил if/else инженером"
  ],
  "correct_index": 1,
  "allow_multiple": false,
  "correct_answer": "Обучение модели на размеченных примерах «вход–выход», чтобы выучить отображение.",
  "explanation": "В обучении с учителем целевые метки направляют оптимизацию; модель учится предсказывать выход по входу."
}
